<?xml version="1.0" encoding="UTF-8"?>
<jonchki-artifact xmlns:xsi="http://www.w3.org/2001/XMLSchema-instance"
                  xsi:noNamespaceSchemaLocation="jonchki/testcase.xsd"
                  version="1.0">
	<info group="com.hilscher.productiontests"
	      module="productiontests"
	      artifact="1234.567R8_demo_board"
	      version="0.0.1"
	      vcs-id="${prj_version_vcs_long}"
	      extension="tar.gz">
		<license name="PROPRIETARY"/>
		<author name="Change me" url="https://www.hilscher.com/" />
		<description>
			A board test for the demo board.
		</description>
	</info>
	<dependencies>
		<dependency group="org.muhkuh.tools"         module="muhkuh_tester_webui"   artifact="lua5.4-muhkuh_tester_webui" version="0.0"/>
		<dependency group="org.muhkuh.tests"         module="bootpins"              artifact="bootpins"                   version="1.3"/>
	</dependencies>
	<actions>
		<action name="finalizer" file="${define_finalizer}"/>
	</actions>
</jonchki-artifact>
